type,lat,lon,name
shopping,34.0311187,-118.8423135,Trancas Market Shopping Center
shopping,34.1722274,-118.5584185,Capri Plaza Shopping Center
shopping,34.1616723,-118.5117504,Courtyard Shops Of Encino Shopping Center
shopping,34.1605612,-118.5106392,Encino Oaks Shopping Center
shopping,34.1602834,-118.5086948,Encino Town Center Shopping Center
shopping,34.189727,-118.6256429,Fallbrook Mall Shopping Center
shopping,34.189727,-118.6261985,Fallbrook Mall Shopping Center
shopping,34.2019489,-118.5720307,Independence Square Shopping Center
shopping,34.1875048,-118.5553632,Loehmanns Plaza Shopping Center
shopping,34.2375035,-118.554531,Northridge Fashion Center Shopping Center
shopping,34.2419478,-118.5586979,Northridge Pavilion Shopping Center
shopping,34.2288927,-118.5606421,Northridge Plaza Shopping Center
shopping,33.7694611,-118.3670172,Town And Country Shopping Center
shopping,33.8361268,-118.3542402,Village Del Amo Shopping Center
shopping,34.2005601,-118.5720306,Sherman Plaza Shopping Center
shopping,34.1805606,-118.604531,The Promenade At Woodland Hills Shopping Center
shopping,34.1905604,-118.6039757,Topanga Plaza Shopping Center
shopping,34.2347258,-118.5528642,Walnut Grove Shopping Center
shopping,34.169172,-118.6048086,Warner Plaza Shopping Center
shopping,34.1672275,-118.5889748,Woodland Hills Village Plaza Shopping Center
shopping,34.1527831,-118.7587012,Agoura Meadows Shopping Center
shopping,34.1561166,-118.643976,Parkway Calabasas Shopping Center
shopping,34.1883381,-118.6414766,Platt Village Shopping Center
shopping,34.1438944,-118.7550897,Whizins Mall Shopping Center
shopping,34.0166791,-118.3345203,Crenshaw Square Shopping Center
shopping,34.1813944,-118.3945246,Laurel Plaza Shopping Center
shopping,34.013068,-118.3403537,Santa Barbara Plaza Shopping Center
shopping,34.0702877,-118.3600774,Town And Country Shopping Center
shopping,34.1583391,-118.4939721,Rubio Plaza Shopping Center
shopping,34.1569505,-118.4367478,Sherman Oaks Fashion Square Shopping Center
shopping,34.1552838,-118.4673044,Sherman Oaks Galleria Shopping Center
shopping,34.1525062,-118.4475815,Sherman Oaks Square Shopping Center
shopping,34.1513951,-118.4473037,Sherman Oaks Town Center Shopping Center
shopping,34.223615,-118.4492496,Panorama Mall Shopping Center
shopping,34.2344479,-118.4492498,Vannord Center Shopping Center
shopping,34.1872274,-118.4170255,Victory Plaza Shopping Center
shopping,34.1430625,-118.393135,Studio City Plaza Shopping Center
shopping,34.2222262,-118.397581,Canyon Plaza Shopping Center
shopping,33.7936279,-118.3331281,Airport Plaza Shopping Center
shopping,33.7897389,-118.3406281,Country Hills Shopping Center
shopping,33.8716822,-118.3256291,Crenshaw Shopping Center
shopping,33.8397373,-118.3903521,The Pier Shopping Center
shopping,33.7747222,-118.3769444,Peninsula Shopping Center
shopping,33.8672222,-118.3536111,Galleria Shopping Center
shopping,34.0897222,-118.3447222,West Hollywood Gateway Shopping Center
shopping,34.0663889,-118.3830556,Wilshire-Robertson Plaza Shopping Center
shopping,33.8861111,-118.4086111,Metlox Plaza Shopping Center
shopping,34.256114,-118.5375864,Northridge Shopping Center
shopping,33.8039055,-118.3286837,Crossroads Shopping Center
shopping,34.040288,-118.4261899,Westside Pavilion Shopping Center
shopping,34.2077821,-118.5089737,Saticoy Plaza Shopping Center
shopping,34.1688943,-118.5350846,Tarzana Square Shopping Center
shopping,34.0702877,-118.3584106,Parklabrea Shopping Center
shopping,34.0902871,-118.3489662,Movietown Plaza Shopping Center
shopping,33.7469619,-118.114787,Seaside Village
shopping,33.7602958,-118.1909014,Shoreline Village
shopping,33.9272378,-118.2384055,Kenneth Hahn Plaza Shopping Center
shopping,33.85946,-118.1178446,Lakewood Marketplace Shopping Center
shopping,33.9644592,-118.2242389,South Gate Plaza Shopping Center
shopping,33.7569617,-118.108398,The Market Place Shopping Center
shopping,33.9297367,-118.324241,Crenshaw Imperial Plaza Shopping Center
shopping,33.8889044,-118.3053511,Pacific Square Shopping Center
shopping,33.8916823,-118.2975733,Gardena Valley Shopping Center
shopping,33.9352921,-118.1195127,Stonewood Shopping Center
shopping,33.8894598,-118.3084068,Tozai Shopping Center
shopping,33.9605685,-118.0311769,The Quad At Whittier Shopping Center
shopping,33.915847,-118.0303425,Mirada West Shopping Center
shopping,33.8505715,-118.1406231,Lakewood Center Mall Shopping Center
shopping,33.8486271,-118.1431231,Lakewood Square Shopping Center
shopping,33.8883478,-118.0653432,Alondra Shopping Center
shopping,33.8652929,-118.0828434,Artesia Town Center Shopping Center
shopping,33.8664041,-118.0953439,Best Plaza Shopping Center
shopping,33.857793,-118.0814544,Lincoln Station Shopping Center
shopping,33.8741817,-118.0814547,Pioneer Artesia Shopping Center
shopping,33.8600149,-118.047842,Cerritos Plaza Shopping Center
shopping,33.8575153,-118.0917325,Cerritos South Town And Country Shopping Center
shopping,33.8622376,-118.1014552,Cerritos Auto Square
shopping,33.8341827,-118.1156218,Carwood Shopping Center
shopping,33.7508512,-118.3078492,Park Plaza Shopping Center
shopping,33.8436281,-118.261183,South Bay Pavilion At Carson Shopping Center
shopping,33.755851,-118.3114605,Terrace At South Bay Shopping Center
shopping,33.8491826,-118.1342339,Sycamore Plaza Shopping Center
shopping,33.9180691,-118.012842,Crossroad Shopping Center
shopping,33.918069,-117.9953414,Green Hills Plaza Shopping Center
shopping,33.8322377,-118.0642309,Hawaiian Gardens Square Shopping Center
shopping,33.9697364,-118.177293,Bell Shopping Center
shopping,33.8952938,-118.2231268,Compton Towne Center Shopping Center
shopping,33.7614065,-118.3111828,Westmont Plaza Shopping Center
shopping,33.8386277,-118.1845135,Bixby Knolls Shopping Center
shopping,33.8464051,-118.1592348,Color Corner Shopping Center
shopping,33.8733491,-118.3003508,Gardena Gateway Shopping Center
shopping,33.9041811,-118.0836776,Norwalk Town Square Shopping Center
shopping,33.736685,-118.308127,Weymouth Corner Shopping Center
shopping,33.9405691,-118.0495104,Santa Fe Springs Mall Shopping Center
shopping,33.9475137,-118.0884008,Santa Fe Springs Promenade Shopping Center
shopping,33.9494588,-118.1634033,South Gate Towne Center Shopping Center
shopping,33.943626,-118.1981266,Tweedy Marketplace Shopping Center
shopping,33.9683474,-118.1653481,Bell Gardens Marketplace Shopping Center
shopping,33.8758489,-118.1509017,Bellflower Plaza Shopping Center
shopping,33.8425166,-118.2884057,Alpine Village Shopping Center
shopping,33.8325164,-118.3097949,Eastgate Plaza Shopping Center
shopping,33.9014037,-118.1172898,Rosewood Center Shopping Center
shopping,33.9186111,-118.0094444,Home Depot Shopping Center
shopping,33.8625153,-118.0942327,Los Cerritos Shopping Center
shopping,33.9133476,-118.0842333,Norwalk Shopping Center
shopping,33.9186252,-118.0745108,Paddison Square Shopping Center
shopping,33.9400134,-118.044788,Santa Fe Springs Plaza Shopping Center
shopping,34.0777877,-118.115903,Alhambra Valley Shopping Center
shopping,34.0702873,-118.0225666,El Monte Shopping Center
shopping,34.0783433,-118.1350704,Crawfords Corner Shopping Center
shopping,34.0619542,-118.019233,Five Points Plaza Shopping Center
shopping,34.1486187,-118.2470191,Glendale Fashion Center Shopping Center
shopping,34.1511178,-118.0697906,Hastings Ranch Plaza Shopping Center
shopping,33.9866807,-118.1861824,Maywood Village Square Shopping Center
shopping,34.1394512,-118.006455,Monrovia Shopping Center
shopping,34.0191789,-118.1067357,Montebello Mart Shopping Center
shopping,34.031123,-118.1228474,Montebello Plaza Shopping Center
shopping,34.035567,-118.0842351,Montebello Town Center Shopping Center
shopping,34.0333448,-118.0953465,Montebello Town Square Shopping Center
shopping,34.1388958,-117.9831208,Mountain Vista Plaza Shopping Center
shopping,34.1680619,-118.1328485,North Lake Square Shopping Center
shopping,33.9883477,-118.224517,Pacific Center Shopping Center
shopping,34.0741764,-118.0706237,Rosemead Square Shopping Center
shopping,34.0019571,-118.0872906,Pico Rivera Plaza Shopping Center
shopping,34.2016717,-118.1925732,Plaza De La Canada Shopping Center
shopping,34.0630662,-118.1336813,Landmark Shopping Center
shopping,34.0577887,-118.1334035,Monterey Park Mall Shopping Center
shopping,34.1347294,-118.0514566,Santa Anita Fashion Park Shopping Center
shopping,34.2602803,-118.3148005,Sunland Mall Shopping Center
shopping,34.2230597,-118.2361861,The Marketplace Shopping Center
shopping,33.9811237,-118.0378442,Village Square Shopping Center
shopping,33.9819572,-118.0514558,Whittier Station Shopping Center
shopping,33.9986236,-118.0564563,Model Plaza Shopping Center
shopping,34.1408402,-118.0197888,Arcadia Specialty Center Shopping Center
shopping,33.9772364,-118.1875712,Bell Palm Plaza Shopping Center
shopping,34.1325074,-118.0661793,El Rancho Santa Anita Shopping Center
shopping,33.9733464,-118.073123,Santa Fe Springs Market Place Shopping Center
shopping,34.0380674,-118.144237,Atlantic Square Shopping Center
shopping,34.0997316,-118.2928534,Barnsdall Square Shopping Center
shopping,34.0550112,-118.3086868,Koreatown Plaza Shopping Center
shopping,34.0255684,-118.2847969,University Village Shopping Center
shopping,34.0425117,-118.3100756,Western Plaza Shopping Center
shopping,34.062233,-118.313687,Wilshire Gramercy Plaza Shopping Center
shopping,34.145285,-118.1434043,Plaza Pasadena Shopping Center
shopping,34.0622325,-118.0917354,Garvey Square Shopping Center
shopping,34.1622288,-118.3142438,Rancho Marketplace Shopping Center
shopping,34.0816762,-118.0764573,Universal Square Shopping Center
shopping,34.0116792,-118.1084025,Crawfords Shopping Center
shopping,34.1547222,-118.2444444,Glendale Plaza Shopping Center
shopping,34.1472222,-118.0888889,El Nido Plaza Shopping Center
shopping,34.0414014,-118.2497961,Los Angeles Flower Mart
shopping,34.1511178,-118.0725685,Hastings Ranch Shopping Center
shopping,34.1383402,-118.0120107,Huntington Oaks Shopping Center
shopping,34.1041753,-118.074235,Elm Center Shopping Center
shopping,34.1147303,-118.0731239,Temple City Square Shopping Center
shopping,34.1355636,-118.2159068,Eagle Rock Plaza Shopping Center
shopping,34.1508333,-118.0816667,Hastings Village Shopping Center
shopping,34.1280634,-117.8917287,Foothill Center Shopping Center
shopping,34.0852872,-117.8717279,Berkeley Square Shopping Center
shopping,34.1075089,-117.7958921,Canyon Shopping Center
shopping,34.1208423,-117.7061671,Claremont Heights Shopping Center
shopping,34.1080648,-117.7378345,Foothill And Towne Shopping Center
shopping,34.1077866,-117.8189485,Foothill Village Shopping Center
shopping,34.1063978,-117.8086703,Frontier Village Shopping Center
shopping,34.1061203,-117.7472793,Garey Shopping Center
shopping,34.1297301,-117.8656167,Glendora Shopping Center
shopping,34.0733431,-117.8717279,Grand Creek Shopping Center
shopping,34.1277859,-117.8295044,Lone Hill Shopping Center
shopping,34.1291745,-117.882284,College Center Shopping Center
shopping,34.0716762,-117.957842,Baldwin Park Towne Center Shopping Center
shopping,34.0869535,-117.9058958,Covina Square Shopping Center
shopping,34.1050085,-117.9056181,Covina Town Square Shopping Center
shopping,34.0897312,-117.9089516,Covina Village Shopping Center
shopping,34.0736208,-117.8856173,Eastland Shopping Center
shopping,34.1147304,-117.9050626,Edgewood Shopping Center
shopping,34.0094561,-117.9620088,Gale Square Shopping Center
shopping,34.0580656,-117.937008,Glenvine Shopping Center
shopping,33.9747351,-117.8392261,Country Hills Town Center Shopping Center
shopping,33.9869569,-117.902562,Eastwood Village Shopping Center
shopping,33.9858459,-117.8708941,Fairway Plaza Shopping Center
shopping,34.0702874,-117.9328411,Plaza At West Covina Shopping Center
shopping,34.0105675,-117.8856171,Quail Ridge Shopping Center
shopping,34.0483438,-117.9072847,South Hills Plaza Shopping Center
shopping,34.0505659,-117.9453415,South Hills Shopping Center
shopping,34.0519546,-117.9536752,Sunset Square Shopping Center
shopping,34.026678,-117.8945064,Walnut Hills Plaza Shopping Center
shopping,33.9900123,-117.9328408,Bixby Hacienda Plaza Shopping Center
shopping,34.0886201,-117.9350636,Irwindale Square Shopping Center
shopping,33.9955679,-117.90784,The Plaza At Puente Hills Shopping Center
shopping,34.0783427,-117.9072848,West Covina Plaza Shopping Center
shopping,33.9936234,-117.9272852,Puenta Hills Mall Shopping Center
shopping,33.9897345,-117.9253405,Ross Plaza Shopping Center
shopping,34.10612,-117.8058924,Puddingstone Shopping Center
shopping,34.1075088,-117.8272821,San Dimas Plaza Shopping Center
shopping,34.0014013,-117.8097811,Towne Centre Village Shopping Center
shopping,34.073621,-117.8286709,Via Verde Plaza Shopping Center
shopping,34.1077871,-117.7300566,Alpha Beta Shopping Center
shopping,34.0805658,-117.7206118,Claremont Center Shopping Center
shopping,34.1075094,-117.703667,College Center Shopping Center
shopping,34.1077871,-117.7233897,Griswolds Old School House Shopping Center
shopping,34.0897321,-117.7183895,Pepper Tree Square Shopping Center
shopping,34.107787,-117.7356123,Stater Brothers Shopping Center
shopping,34.3808311,-118.5431415,Old Orchard Shopping Center
shopping,34.4205518,-118.5611975,River Oaks Shopping Center
shopping,34.4158296,-118.4553609,Sierra Plaza Shopping Center
shopping,34.4152741,-118.467028,The Knoll Shopping Center
shopping,34.4152742,-118.5570307,Valencia Mall Shopping Center
shopping,34.4216628,-118.5431413,Valencia Mart Shopping Center
shopping,34.4341623,-118.5303631,Bouquet Canyon Square Shopping Center
shopping,34.4172184,-118.4736949,Canyon Center Shopping Center
shopping,34.4972152,-118.62231,Castaic Shopping Center
shopping,34.4038858,-118.5509194,Granary Square Shopping Center
shopping,34.4277737,-118.5348078,Bouquet Center Shopping Center
shopping,33.8280715,-118.3497956,Del Amo Fashion Center
shopping,33.7919612,-118.3311836,Rolling Hills Plaza Shopping Center
shopping,33.8711261,-118.3550742,South Bay Shopping Center
shopping,33.799738,-118.3889626,Malaga Cove Plaza Shopping Center
shopping,33.9861235,-118.3931325,Fox Hills Mall Shopping Center
shopping,33.983068,-118.3928546,Fox Hills Plaza Shopping Center
shopping,34.0397322,-118.4378568,Lamancha Shopping Center
shopping,33.9786239,-118.3725763,Ladera Shopping Center
shopping,34.0208452,-118.3561877,Baldwin Hills Shopping Center
shopping,34.0927867,-118.3795227,Sunset Plaza Shopping Center
shopping,34.0188993,-118.4564681,Ocean Park Plaza Shopping Center
shopping,34.0750095,-118.3773002,Beverly Center Shopping Center
shopping,34.0494538,-118.4617465,Brentwood Place Shopping Center
shopping,34.0588985,-118.4189678,Century City Center Shopping Center
shopping,34.0136211,-118.493969,Santa Monica Place Shopping Center
shopping,34.0305653,-118.4850802,Wilshire West Shopping Center
shopping,34.0022342,-118.3934105,Raintree Plaza Shopping Center
shopping,34.0438996,-118.3786886,Ward Plaza Shopping Center
shopping,34.2819461,-118.4536947,La Rinda Shopping Center
shopping,34.2730577,-118.5003631,Balboa-Mission Square Shopping Center
shopping,34.2577806,-118.5370308,Devonshire-Reseda Shopping Center
shopping,34.2663914,-118.525086,Granada Village Shopping Center
shopping,34.2566695,-118.5003631,North Hills Shopping Center
shopping,34.2494478,-118.6050882,Topango Festival Shopping Center
shopping,34.2605581,-118.325912,Sunland Shopping Center
shopping,34.3102783,-118.429527,Sylmar Shopping Center
shopping,34.3086117,-118.4339717,Sylmar Square Shopping Center
shopping,34.300001,-118.4420275,Sylmar Towne Shopping Center
shopping,33.9322366,-118.3253522,Crenshaw Imperial Shopping Center
shopping,33.9208475,-118.3514638,Hawthorne Plaza Shopping Center
shopping,33.8922362,-118.3956309,Sepulveda Shopping Center
shopping,34.0211187,-118.8098118,Point Dume Plaza Shopping Center
shopping,34.2352813,-118.5020296,Balboa Nordhoff Shopping Center
shopping,33.9014029,-118.3859086,Manhattan Marketplace Shopping Center
shopping,33.898625,-118.3953532,Manhattan Village Shopping Center
shopping,33.8575151,-118.3634074,North Torrance Shopping Center
shopping,33.8133492,-118.3672957,Pacific Plaza Shopping Center
shopping,33.8383489,-118.3553514,Plaza Del Amo Shopping Center
shopping,33.7708499,-118.3709062,The Shops At Palos Verdes Shopping Center
shopping,33.853071,-118.352296,Torrance Promenade Shopping Center
shopping,33.7486276,-118.4059065,Golden Cove Shopping Center
shopping,33.8652923,-118.3942415,Hermosa Beach Pavilion Shopping Center
shopping,33.9872347,-117.8717275,Canyon Point Marketplace Shopping Center
shopping,33.9966667,-117.8891667,Rowland Heights Plaza Shopping Center
shopping,34.0888,-117.7377,The Valley Center Shopping Center
shopping,34.0616774,-117.7225562,Indian Hill Marketplace Shopping Center
shopping,33.9911234,-117.9225627,Puente Hills East Shopping Center
shopping,34.6888743,-118.1120165,East Lancaster Plaza Shopping Center
shopping,34.6744303,-118.1497954,Lancaster Commerce Center Shopping Center
shopping,34.4908266,-118.1625741,Santiago Square Shopping Center
shopping,34.6610974,-118.1825742,West Lancaster Plaza Shopping Center
shopping,34.6774857,-118.1578511,Antelope Valley Center Shopping Center
shopping,34.6883185,-118.1667402,Antelope Valley Plaza Shopping Center
shopping,34.6044444,-118.1513889,Antelope Valley Mal Shopping Center
shopping,34.37904848,-118.5430491,Lyons Station Shopping Center
shopping,34.2708355,-118.5003631,Balboa-Mission Shopping Center
shopping,33.94977699,-118.3443403,Holly Park Plaza Shopping Center
shopping,34.16987866,-118.5394818,Brown Center Shopping Center
shopping,34.16181816,-118.5137111,Encino Junior Shopping Center
shopping,34.16102805,-118.5080516,Plaza De Oro Shopping Center
shopping,34.18750611,-118.3975017,Valley Plaza Shopping Center
shopping,34.15687762,-118.7576687,Twin Oaks Agoura Shopping Center
shopping,33.89706459,-118.0074012,La Mirada Towne Center Shopping Center
shopping,33.79196106,-118.2664222,Wilmington Plaza Shopping Center
shopping,33.88672482,-118.0844986,Alondra Square Shopping Center
shopping,33.86264729,-118.0939722,Los Cerritos Center Shopping Center
shopping,33.8756712,-118.1522834,Bellflower Towne Center Shopping Center
shopping,34.05088603,-118.2489878,Grand Central Market
shopping,34.0638998,-118.2972977,Chapman Plaza Shopping Center
shopping,34.15011664,-118.0020583,Foothill Park Plaza Shopping Center
shopping,34.09475658,-118.1258261,Alhambra Place Shopping Center
shopping,34.13843125,-118.2151222,Eagle Rock Town Square Shopping Center
shopping,34.06322789,-118.089788,Beaches Shopping Center
shopping,34.14480691,-118.2584882,Glendale Galleria Shopping Center
shopping,34.1397222,-118.0219444,Arcadia Gateway Centre Shopping Center
shopping,34.06133473,-118.2393211,Far East Plaza Shopping Center
shopping,34.04889481,-118.2398629,Japanese Village Plaza Mall Shopping Center
shopping,34.0483333,-118.2586111,Macy's Plaza Shopping Center
shopping,34.13312967,-117.8992117,Azusa Square Shopping Center
shopping,34.05182384,-117.9444337,Hacienda Plaza Shopping Center
shopping,34.06796505,-117.931999,West Covina Parkway Plaza Shopping Center
shopping,34.0707379,-117.9328895,Westfield West Covina Shopping Center
shopping,34.0294555,-117.9142293,Woodside Village Shopping Center
shopping,33.9935575,-117.9274607,Puente Hills Mall Shopping Center
shopping,34.10496446,-117.8164816,San Dimas Station Shopping Center
shopping,34.11589058,-117.8328967,Glendora Marketplace Shopping Center
shopping,34.04752137,-118.4904671,Brentwood Country Mart Shopping Center
shopping,34.06993805,-117.8893518,Country Club Shopping Center
shopping,34.69402653,-118.172915,Valley Central Shopping Center
shopping,34.27730799,-118.5656333,Porter Ranch Town Center Shopping Center
shopping,34.07186657,-118.3602941,Farmers Market Shopping Center
shopping,33.83065811,-118.0868483,Long Beach Towne Center Shopping Center
shopping,34.38452937,-118.5696459,Valencia Marketplace Shopping Center
shopping,34.01047909,-118.3364439,Baldwin Hills Crenshaw Plaza Shopping Center
shopping,33.90643252,-118.3936286,Plaza El Segundo Shopping Center
shopping,34.10208612,-118.3390242,Hollywood & Highland
shopping,34.15863103,-118.6345017,El Camino Shopping Center
shopping,34.02851321,-118.2608217,Eagle's Nest Shopping Center
shopping,33.87139544,-118.0591786,Cerritos Towne Center Shopping Center
shopping,33.7327966,-118.2775709,Ports O' Call Village Shopping Center
shopping,34.07239091,-118.358109,The Grove Shopping Center
shopping,34.15359708,-118.6444473,Commons at Calabasas Shopping Center
shopping,34.14113075,-118.2251,Eagle Rock Plaza Shopping Center
shopping,33.85045895,-118.1409431,Lakewood Center Shopping Center
shopping,33.86733327,-118.0954742,Cerritos Best Plaza Shopping Center
shopping,33.93933681,-118.0483747,Gateway Plaza Center Shopping Center
shopping,34.14369254,-118.2568359,Americana at Brand Shopping Center
shopping,34.01711339,-118.4069109,Culver Center Shopping Center
shopping,34.18330816,-118.3120841,Burbank Town Center Shopping Center
shopping,34.00656586,-118.1533241,The Citadel Outlets Shopping Center
shopping,33.77392142,-118.3760548,The Avenue Of The Peninsula Shopping Center
shopping,34.13802276,-118.1327677,The Shops On Lake Avenue 
shopping,33.79437735,-118.1232619,South Los Altos Market Center Shopping Center
shopping,33.79794371,-118.1226611,North Los Altos Market Center Shopping Center
shopping,33.773364,-118.190185,City Place Long Beach 
shopping,33.98403012,-118.0945569,Pico Rivera Towne Center Shopping Center
shopping,34.4043249,-118.4611452,Sierra Canyon Plaza Shopping Center
shopping,33.94282591,-117.9963398,Whittwood Town Center Shopping Center
shopping,34.18908583,-118.330307,Burbank Empire Shopping Center
shopping,34.22326448,-118.4469616,Panorama Plaza Shopping Center
shopping,34.59744777,-118.1450629,The Marketplace Shopping Center
shopping,33.92697249,-118.1298173,Downey Landing Shopping Center
shopping,34.00899386,-117.8859669,Bestway Supermarket Shopping Center
shopping,33.89898813,-118.3936501,Manhattan Village Mall
shopping,33.7602951,-118.1161761,Marina Pacifica
shopping,33.97891016,-118.4379387,Waterside Marina del Rey Shopping Center
shopping,33.97220169,-118.4463072,Fisherman's Village
shopping,33.97033319,-118.4495795,Del Rey Landing Fuel Dock
shopping,33.98327393,-118.4594017,Marina Beach Shopping Center
shopping,34.01081704,-118.4958959,Santa Monica Beach and Pier
shopping,33.34379859,-118.3248675,Green Pleasure Pier
shopping,33.83916894,-118.3906728,Redondo Beach and Pier
shopping,33.97066686,-118.4462214,Los Angeles County Department Of Beaches And Harbors
shopping,33.97948845,-118.4401918,Marina Del Rey Visitors Information Center
shopping,33.97902581,-118.466928,"Venice Beach, Pier, Ocean Front Walk (Restaurants and Shopping)"
